{
  "id": "pass-007",
  "description": "package.json only - classified as unknown domain (ignored)",
  "repo": "expressjs/express",
  "pr_number": 7057,
  "expected": "pass",
  "rationale": "package.json does not match any domain pattern (not .toml/.yaml/.yml/.env, not in /config/). Classified as unknown domain which is ignored. 0 active domains = PASS.",
  "category": "single-domain",
  "domains_expected": [],
  "ecosystem": "javascript",
  "notes": "FALSE NEGATIVE example: package.json is a config file conceptually, but ghlint classifies it as unknown. A PR bumping a vulnerable dependency in package.json passes even if mixed with API changes, because package.json itself doesn't count."
}
