{
  "id": "pass-004",
  "description": "API-only PR - single routing.py file",
  "repo": "fastapi/fastapi",
  "pr_number": 15038,
  "expected": "pass",
  "rationale": "fastapi/routing.py contains 'route' substring, classified as api domain. Single domain = PASS.",
  "category": "single-domain",
  "domains_expected": ["api"],
  "ecosystem": "python",
  "notes": "Bug fix in router. Classic single api-domain change."
}
